{
  "schema_version": "1.0",
  "event_id": "fictional-call-1",
  "task_id": "fictional-task-1",
  "workload_id": "fictional-tailoring-en-v1",
  "phase": "generation",
  "provider_id": "fictional-host",
  "model_id": "example/model-a",
  "effort": "low",
  "status": "success",
  "accepted": false,
  "observed_utc": "2026-10-27T00:00:00+00:00",
  "duration_ms": 10,
  "usage": {
    "kind": "per_call",
    "input_tokens": 100,
    "output_tokens": 20,
    "cached_input_tokens": null,
    "reasoning_tokens": null
  },
  "cost": null,
  "source": {
    "kind": "host_export",
    "path": "observations/fictional-source.json",
    "sha256": "0000000000000000000000000000000000000000000000000000000000000000"
  }
}
